,제목,내용,주소
10,"신년 계획 관리하고 갓생 살기, 아이폰 어플 추천 - Check! Planning Partner : 네이버 블로그","신년 계획 관리하고 갓생 살기, 아이폰 어플 추천 - Check! Planning Partner Check! Planning Partner 출처 : Nikelodeon 신년이 되면 많은 사람들이 새해 목표를 세운다 하지만 시간이 지나면 흐지부지 해지기 마련 내가 세운 목표를 잊지 않고 매일 잊지 않고 꾸준히 실행하기 위해서 가장 중요한 것은 바로 기록을 통한 목표 관리 하루하루 나의 실천과 노력을 기록하고 진행율과 실행 관리를 통해 성취감을 얻는 것이 목표 달성을 위한 최고의 동기부여 평소에 즐겨 사용하던  목표/계획 관리 어플 이 있어 신년 맞이  갓생살기 를 위해 추천해보고자 한다 출처 : 출판사 미래의창 너무 자주 뵈어서 길에서 마주치면 나도 모르게 인사드릴 것만 같은.. 한국 트렌드리딩의 대부(?) 김난도교수님 연말연초가 되면 서점에 트렌드코리아가 깔려서 종종 구매하기도 하고 서문이나 목차만 읽기도 하는데 2022년 올해 나온 키워드 중 공감 갔던 것이 바로 바른 생활 루틴이 Routinize yourself 친구들 만나면 부동산, 주식, 코인 이야기에 코로나19로 2년 째 뒤숭숭한 일상 재택이다 9시 통금이다 개인 시간은 늘어나지만 왜인지 미래 불확실성이 높아지고 내 일상은 점점 희미해져가는 느낌이다 루즈해지는 일상과 불안한 미래에 대한 스트레스를 규칙적인 생활을 통한 자기관리로 다스리며 삶의 만족도와 성취감을 높이는 사람이 바로 바른 생활 루틴이 내 주위만 봐도 10분 5분을 쪼개가며 계획한 목표 달성을 위해 부지런히 꾸준히 성실하게 자기관리를 하는 친구들이 많아졌다 신년 목표/계획 관리 - Check! 어플 추천 아름다운 구속..(?) Check! Planning Partner 내 나름의 루틴을 지속시켜주는 4년째 사용 중인 목표 관리 어플  'Check!' 깔끔한 인터페이스와 단순한 구성으로 매일 사용해도 크게 번거롭지 않은 게 장점 나는 주로  식단과 운동 기록용 으로 사용 중이다 Check! 어플 구성과 사용법 세상 간단하지만 자세한 기록도 가능! Check! 어플 기본 페이지 어플을 가동하면 내가 설정해둔 목표 목록이 뜬다 우측 상단 '+' 아이콘을 누르면 새로운 항목을 추가할 수 있다 톡톡 한 번이면 입력 가능 목록을 누르면 이렇게 캘린더가 뜨는데, 각 목표 달성 여부를 매일 O / X 체크하는 식.  날짜칸에 두 번 터치하면 값이 입력되고 또 두 번 터치하면 수정된다 탭탭하면 끝이라 매우 직관적이고 간단함! 하단 통계 은근 유용하다 메모도 일상조각 아카이빙에 큰 도움이 된다 내가 원하는 컬러로 지정하기 새로운 목표를 위한 캘린더를 생성할 때 서로 다른 컬러 지정을 통해 구분 관리가 가능하다 목표 달성 여부는  총 4개 방식으로 체크가 가능 하다 1단계 : 달력에 체크만 하기 2단계 : 달성/미달성 두 가지로 O,X 3단계 : 달성/미달성 그리고 세모 5단계 : 매우달성 달성 보통 약간미달성 미달성(?) 단순히 달성/미달성이 아니라 세부적으로 목표 달성 관리를 할 수 있어 좋다 물론 매일 세운 목표를 100% 완수하면 좋겠지만, 시작은 했으지만 미완수한.. 그런 아쉬운 경우 그래도 X를 주기엔 내 노력이 아쉬우니까.. 예) 매일 목표 : 매일 물 다섯잔 마시기 물 3잔 마신 경우 세모 스티커 붙여주기 😇   메인페이지 옆에는 내 목표를 한 눈에 볼 수 있는 써머리 메뉴 와 전체 목표에 대한 통계 메뉴 가 있어서 내 모든 목표를 얼마나 잘 달성하고 있는지 종합성적표  같은 개념으로 확인 할 수 있다 Check! 어플, 효과는? 그 효과는 엄청났다..! 슬라이드를 넘겨주세요 내가 이 어플을 처음 시작한 18년 9월 월 매일 운동 달성률은  36%  였는데 약 3년이 지난 21년 4월에는  86% 를 달성했다 매일 내 목표를 기록한다는 것이 별 거 아닌 일 같지만 꽤 동기부여가 되기 때문에 하루가 지나기 전 꼭 실행하고 싶어지게 된다 이렇게 그날 운동량과 방법을 기록할 수 있어 시간이 지나고 확인할 수 있는 점도 좋다 Check! 어플과 함께라면 나도 오늘부터 바른생활 루틴이 🖤 출처 : tvN 내가 정말 좋아하는 이동진 평론가님의 말 하루하루는 성실하게 인생 전체는 되는대로 자연과학에 나오는 프랙탈이란 개념처럼 나의 매일이 모여 내 인생을 만든다 좀 더 나은 나, 좀 더 행복한 나를 위해 작은 목표와 계획일지라도 오늘부터 시작해보자 New year, New me! ",http://blog.naver.com/PostView.naver?blogId=xoxox_&logNo=222613063480&from=search&redirect=Log&widgetTypeCall=true&directAccess=false
11,"22년 신년 계획, 행크에듀 부자되는세상님의 재테크 기초반 수강후기! : 네이버 블로그","22년 신년 계획, 행크에듀 부자되는세상님의 재테크 기초반 수강후기! 안녕하세요!  🐢거북이재테크 림하입니다! 새해를 맞아 다들 신년계획 세웠을텐데요! ✔️22년 저의  소소한 계획 은 가족 여행, 헬스장 등록하기, 아침 6시 일어나기, 블로그&유튜브 주1회 업로드하기 ✔️22년  큼직한 계획 은 이직하기, QQQ 20주 만들기,  그리고 부동산 매수 1개 이 중 가장 어려울 것 같은 계획은 부동산 매수죠..! 작년에 부동산 경매 공부도 하고, 임장도 갔지만 아직 모아둔 시드가 부족하다는걸 많이 느꼈습니다. 22년 4월쯤 청년내일채움공제가 끝나면 모아둔 돈과 청내공 돈 일부를 투자할 예정입니다. 이렇게 블로그에 적어두면  이루기위해 더 노력하지 않을까요?!🤣 돈을 모으는 기간동안 공부하는게 정말 중요하다고 생각했어요! 작년에 공부한 부동산 경매도 벌써 잊혀진 내용들이  많더라구요😭 (크롸잉 크롸잉) 그래서  행크에듀 에  부자되는세상님  재테크 기초반 강의 를 신청했어요! (내돈내산) 행크에듀, 재테크 기초반 후기 이미  부세님 에 대해 알고계시는 분들도 계실텐데요. 20대 중반에 투자를 시작해  30억 자산가 가 된  분입니다! 유튜브에 무료 강의랑 인터뷰 영상들도 많이 올라와서 관심 있는 분들은 영상 참고하셔도 좋을 것 같아요 : ) 재테크 기초반 커리큘럼 강의를 빨리 듣고싶어서 교재 도착하기도 전에 1주차 강의를 들었어요ㅎㅎ 1주차 강의의 경우  지식보다는 마인드에 관한 내용이라서 교재가 없어도 충분히 들을 수 있었습니다. 총 4주차 커리큘럼이구요. 저는 하루 2강씩 들은 뒤,  추가로 공부하고 싶은 내용이 있을 경우  반복해서 들을 예정이예요! 1/4(화) 교재가 도착했는데요,  교재는 강의 내용에 있는 ppt화면과 동일하고 수정된 내용은  행크 카페 에 업로드 된다 합니다! 강의를 들으때마다 느끼는 거지만 과제를 하고, 스스로 물건을 찾는 등 결국 내 힘으로 하나씩 헤쳐나가는게 중요하더라구요. 이번 강의도 열심히 과제해봐야겠습니다!! 부자되는세상 재테크 기초반 신청 이유 1) 부세님을 만나고 싶었어요!  어떤 마인드와 방법으로 30억 자산가가 되었는지 궁금했고 저도 정말정말 배우고 싶었어요! (온라인이지만) 강의를 통해 만날 수 있었고 2) 시드를 모으는 동안 공부는 필수 💪 근로소득 뿐만 아니라  공모주, 애드포스트, 주식, 주말 아르바이트를 통해 시드를 모으고 있는데요.  아무래도 시드가 귀여운 금액이다 보니, 수익도 귀여웠습니다..ㅎㅎ 그래서 이 기간에는 자산을 불리는 상상을 하면서 어떻게 불려가야할지 공부하는 시간이라고 생각했어요! 3) 나에게 맞는 투자가 궁금했어요! 부자되는 세상님의 재테크 기초 강의의 경우 부동산 경매 뿐만 아니라, 분양권, 공매, 저평가 물건 찾기 등등 과정이 있었는데요.  어떤 분야가 저와 잘 맞을지 고민이 되었고, 얕지만 어떤 분야인지 알고있으면 선택에 도움이 될 것 같았어요! 이웃님들의 22년 목표도 궁금하네요!! 다들 열심히 블로그 업로드 해주고 계셔서 항상 배우고 있습니다! 매번 소통해주시고, 응원해주셔서 감사합니다~! 22년 새해복 많이 받으시고, 목표로 하는 일들 함께 이뤄보아요!🙏🏻 ",http://blog.naver.com/PostView.naver?blogId=caryy2200&logNo=222613009870&from=search&redirect=Log&widgetTypeCall=true&directAccess=false
12,2022년 임인년 검은호랑이해🐯 직장인 신년계획 + 결혼준비 : 네이버 블로그,"2022년 임인년 검은호랑이해🐯 직장인 신년계획 + 결혼준비 2022년 맞이 새글을 어떻게 쓸까 고민하다 마침 망고보드에서 신년 달력 템플릿을 다운받았는데, 무료회원이다보니 10슬라이드가 최대라 우리 결혼식이있는 9월까지밖에 받을수가 없었다 ㅎㅎㅎㅎ 2022년 임인년은 호랑이해라고 하네용 🐯 육십간지 중 39번째로 임이 흑색, 인은 호랑이를 의미하는 검은 호랑이의 해 라고 네이버가 알려줬다. 올해 쉬는날은 얼마나있는지 알아버자 2022년 공휴일 2022년 1월 1월1일 토요일 : 신정 1월20일 목요일 : 드레스투어 👉14:00 레이첼 👉16:00 더케네스블랑 드레스투어를 하며 최종 드레스샵을 선택하게 된다. 샵마다 당일지정혜택이 있으니 잘 비교해보고 골라야지😊 1월에는 다이렉트결혼준비 블로그서포터즈 로도 활동하게 되어 일 방문자수 500명 유지를 위해 블로그 관리도 더욱 열심히해야하고 포인트 300만점 모아 졸업하고싶당~~😆 2022년 2월 1월31일 - 2월2일 월, 화, 수 : 설날 2월14일 일요일 : 제주스냅 아직도 한참 남았을 것 같았던 제주스냅이 이제 곧 한달 가까이로 다가왔다. 준비만 했었는데 이제 진짜 실전이라는게 겁나기도 하고... 그래도 나혼자가 아니라 홍이도 함께라는생각에 기대가 많이된다...! 2월중에 아마도 드레스투어로 고른 샵과 남자친구 예복집에서 촬영복 대여를 하게 될 것 같다. 2022년 3월 3월1일 화요일 : 삼일절 3월8일 화요일 : 바시움 리허설촬영 3월9일 수요일 : 제20대 대통령선거 스튜디오촬영은 체력소모가 엄청나다고 한다!! 그래서 일부러 3월9일 대통령선거전날로 빠르게 찜해놨지 😆 2022년 4월 아쉽지만 공휴일이 없다 ㅠㅠㅠ 결혼준비 중 이벤트도  특별히 정해진건 없다! 2022년 5월 5월5일 어린이날 : 목요일 5월8일 부처님오신날 : 일요일 어린이날 쉴텐데용... 망고보드에서 누락했나보다 ㅋㅋㅋㅋ 2022년 6월 6월1일 수요일 : 제8회 지방선거 6월26일 일요일 : 홍이생일 6월30일 목요일 : 뽀요이생일 6월의 마지막주는 파티주가 되겠군요 ㅎㅎ 2022년 7월 공휴일은 없습니다😔 7월엔 신혼집에 살고있는 세입자가 계약만료로 나가기 때문에 이때부터 리모델링을 계획해야할 시기 2022년 8월 8월15일 월요일 : 광복절 결혼식 한달전이니 혼주한복이나 청첩장모임, 마지막 점검 등등 조그맣게 챙겨야 할 일이 많을 것 같다 2022년 9월 9월3일 토요일 : 6주년기념일 & 결혼식 올해 가장 큰 이벤트 이날을 위해 1월부터8월까지 열심히 준비하게 되는데 9월3일까지 무사히 별탈없이 마무리되길 바라는게 가장 큰 새해소망🧧 올해는 재태크공부좀 해볼까한다. 유료강의도 듣고, 도서관에서 책도 빌려보고, 유튜브로 매일 짤막하게 정리해주는 주식영상같은것도 구독하고 스마트스토어 상품등록은 계속되고 블로그 체험단과 후기작성도 열심히!! 당장 내일 1월2일부터 듣게될 4주 강의...ㅎㅎㅎ 내가 잘할수있을지모르겠지만 15만원이나되는 돈들여 수강하니 도움이 되리라🏒🏒🏒 지난번 들었던 소액투자강의에서도 알아두면 좋은 내용이 많았기 때문에 이번에도 좋은 강의 기대하며! +  한달 60만원살기  지난 1년동안은 90만원으로 살았지만 다시 조여매서 60만원으로 살기 도전한다! 2022공모주청약 도전하기 소액투자 강의에서 알게되었는데 1년에 100만원 이상은 벌수있을것같아 열심히 공부하고 실천해보려한다 2022년 공모주 일정 내가 구독하는 유튜버는 기릿의 주식노트 주린이를위해 너무 복잡하지않고 짧은시간의영상으로 집중도를 높여주는 채널이다 집에있는 미러리스 카메라 데려간다 ㅎㅎ 체험단사이트보다보면 사진기자단모집글도 종종 보이는데 매장사진 300~500장 찍어주고 6만원지급해주는 그런활동이 있어 카메라 공부도 하고 주말이나 평일 저녁에 소소한 알바활동도 할 수 있다면 가계에 보탬이 될 것 같아서!!   소니 미러리스  A6000 2014년에 엄마아빠가 한창 사진배우러다니시며 마련한 카메라인데 초보 ~ 중급자용으로 사용하기 좋은모델인것같다. 2022년 특히 상반기 바쁜한해가되겠지만 그만큼 지나고나면 기록도많이 남고 추억거리가 쌓여 의미있는 한해일것 같다🧡 #2022년 #신년계획 #직장인신년계획 #임인년계획 #결혼준비 #검은호랑이해 #새해인사 #새해계획 #22년호랑이해 #올해공휴일 #올해쉬는날 #2022년공휴일 #2022공모주 #공모주일정 ",http://blog.naver.com/PostView.naver?blogId=minimini630&logNo=222610238202&from=search&redirect=Log&widgetTypeCall=true&directAccess=false
13,[프로젝트 관리 템플릿 무료 나눔] 2022년 신년 계획을 위한 PPT 포멧을 만들어 보았습니다 : 네이버 블로그,[공지] [프로젝트 관리 템플릿 무료 나눔] 2022년 신년 계획을 위한 PPT 포멧을 만들어 보았습니다 ,http://blog.naver.com/PostView.naver?blogId=hello_chung&logNo=222605640567&from=search&redirect=Log&widgetTypeCall=true&directAccess=false
14,"신년 계획, 꼭 이루고 싶을 때 필요한 한 가지 팁 : 네이버 블로그",https://blog.naver.com/varkiry05/222605479872 https://blog.naver.com/varkiry05/222394940051 ,http://blog.naver.com/PostView.naver?blogId=varkiry05&logNo=222611441067&from=search&redirect=Log&widgetTypeCall=true&directAccess=false
15,"<잡부의 성장타이쿤> #2 신년계획 세우기, 프로 과몰입러가 될테요 : 네이버 블로그","신년계획 세우기, 프로 과몰입러가 될테요 스스로에게 과몰입 하는 2022년을 만들자! 2022년이라니. 마치 미래세계를 보는 듯 아직은 조금 낯선 숫자이지만, 새로운 한해가 밝았다. 주인장도 드디어 30대에 입성 ;) 숫자 2를 좋아해서 그런가 왠지 더 느낌이 좋은 한해다. 마침 삼재도 끝났고요? 흔히들 그렇듯 매년 두루뭉실한 신년계획을 세워보곤 했다. 돌이켜보면 매년 지켜진 것들이 꽤 있어서 신기하기도 하지만, 반면 몇해에 걸쳐 지키지 못한 약속들이 있었으니... © schwarzeweissheitenfotografie, 출처 Unsplash 고백한다. 코로나 이후로 나는 다이어트를 제대로 시도조차 한적이 없는 아가리 다이어터다. 오히려 중간에 밥 3공기 먹는 친구와 연애를 하게 되면서 함께 넉넉히 먹고다니니 점점 더 행복한 꿀꿀이가 되어가고 있었다.  (아이러니 하게도 만났던 친구는 마른체질이라 같이먹고 살은 나만쪘다. 억울하지만 즐겁게 먹었으니 그걸로 됐다ㅎ..) 뿐만 아니라, 나는 이미 5년전부터 신년마다 유튜브 시작하겠다고 떠들고 다녔던 아가리 유튜버이기도 하다. 5년 전 마음먹고 시작했으면 이미 고인물 유튜버쯤은 됐을텐데 직장인이라 바쁘고 매번 영상찍는게 낯설다는 이유로 미루고 미루고 미루다 5년이 지난 지금도 시작하지 못했다. © jannerboy62, 출처 Unsplash 왜 유독 위 두가지 사항이 실천되지 못했는지 궁극적인 이유를 생각해봤다.  두가지의 공통점은 모두 '장기플랜' 이라는 것이다.  솔직히 확실한 동기부여가 없었던게 한몫 했던 것 같다. 둘다 품이 많이드는대비  스스로 내면에서 '진심으로' 꼭 해야할 이유를 느끼지 못한 것 이다. 살이쪄서 속상하긴 하지만, 타인이 어떻게 생각하든 관심이 없는 성격이라 스스로 딱히 불편함을 느끼는게 없었다. 한번 30kg 이상 감량해봐서 그런지 언젠가 맘먹고 빼면 된다는 생각이 강했기도 했다. 유튜브도 처음엔 마케터로써 현재 가장 영향력있는 SNS채널에서 도태되지 않기 위해 시작하고 싶었던거고, E성향이기에 내가 지속적으로 할 수 있는 컨텐츠를 만들어서 블로그처럼 사람들과 소통하면 재밌겠다는 생각에 하려고 했던 것 같다. 그런데  올해는 꼭 두가지 목표를 컴플리트 하고싶다는 욕심이 생겼다.  일단  늘 신년목표에 자리잡고 있는 두가지가 이제는 좀 사라지고 내년엔 다른 새로운 목표들에 집중하고 싶다는 생각이 들었기 때문 이다. 다이어트에 대한 동기부여는 한번쯤 진짜 건강하고 매력적인 바디를 만들어보고 싶다는 생각을 했는데 그게 딱 올해였으면 좋겠다는 마음이 생겨 충분히 해낼 수 있을 것 같고, 유튜브도 이러다간 해보기도 전에 다음세대의 새로운 채널로 넘어가게 될 것 같아서 한번 도전해보자는 생각이 들었다. © olianayda, 출처 Unsplash 그래서 생각한 올해의 테마가 바로  '스스로에게 과몰입하기'  이다.  2022년의 목표들을 이야기 해보면 큰 틀에서 이정도의 목표들을 정했다. 모두 나 자신의 영혼과 시간에게 과몰입해야 달성할 수 있는 목표라는 생각이 들어서 주제를 그렇게 정해보았다 ;) 하지만 목표들을 정해놓기만 해서는 내년 이시간에 또다시 같은 목표들을 다짐하고 있을 수도 있는데  그런 시나리오는 절대 바라지 않아!!!!!! 그리하여  매월 1일 월간타이쿤 포스팅을 작성 해 달성을 위한 진척이 되고있는지 점검하고 공유하는 시간을 가져보려 한다. 아직 유튜브 컨텐츠를 정하지는 못했는데,  꾸준히 업로드 할 수 있는 것  에 포인트를 두고 시작을 하는게 중요할 것 같다. 이걸 다 이루려면 정말 24시간이 모자란 한해를 보내게 될 것 같은데,  시간은 물리적 영역이기에 목표를 이루기 위해서는 세부적인 계획이 중요하다.  노션에 각 목표별 카테고리를 만들어놓고 월별/주간 플랜을 기획하고 있는 중이다. 벌써 1월이 3일이나 지났다! 2월 1일에는 어느 정도 진척된 월간타이쿤 소식을 전할 수 있길 바라며....💜 함께 읽으면 좋은 글 ",http://blog.naver.com/PostView.naver?blogId=drinkam&logNo=222612099036&from=search&redirect=Log&widgetTypeCall=true&directAccess=false
16,2022 햅삐햅삐 뉴이어! (+신년계획) : 네이버 블로그,"2022 햅삐햅삐 뉴이어! (+신년계획) 크하핫! 벌써 2022 which means.... i am 28...🙄 세월이 빠르게 지나간다는 걸 실감한다. 입사 1년차도 좀 어벙벙했는데 아니 벌써 슴여덟이라니... Oh my gosh..🤭 마음만은 아직 이십대 초반같당. 1/1일인데 해돋이도 안보고 운동도 안하고 공부도 뭐 시원찮게 1시간 반 정도 했다 크크 근데 오래달릴려면 준비를 잘해야하니까 그런고로 오늘은 2022, 신년 계획에 대한  뽜이띵 넘치는 포스팅을 해보려고 한다!🔥 일단 AS I SAID EARLIER... 내 삶은 네 개의 카테고리로 굴러간다고 가정  이렇게 네 가지로 나누겠다. 에 초점을 맞춘 한해로  계획하려고 보고 있다. 2021년은 돌아보니 단연 '취미'가 메인이었다. 하지만, 2022는 서른이 얼마 안남은 관계로 일단 자기개발에 좀 더 몰두할 예정이다.😉 아래 표는 일단 메인 계획만 수록할 예정. 나는 ENFP  MBTI 노답 3대장 중의 대장을 맡고 있지.😎 그래서 그런지 항상 계획대로 흘러가진 않았다. 물론 월단위 계획을 세워도 어그러질 건 알고 있지만 그래도 사람은 포기하면 안돼.😎 그러니까 스근하게 분기 단위의 계획을 공유해보도록 하겠다. 물론 좀 간단 명료하게 ㅎㅎ 2022 연말에 이걸 보고 뿌듯하게 웃을 수 있으면 좋겠다  내 쟉은데 큰 소망..😊😊 공부: CPA 과목들 기본 및 객관식 강의 끝내기 (경영 제외)           (객관식 회계, 재무관리 기본, 재무관리 컴팩트, 객관식 재무관리)           CPA 과목들 각 과목 2회독 이상           매경테스트 (1/8) - 최우수 등급           TESAT (1/15) - S등급           김정환 금융논술 ZOOM  강의 듣기 운동: 2월 바프 2개 끝내기 (커플, 개인)          새로운 운동 도전 (IF 부산대, 플라잉요가)          4일주기 2일 이상 40분 이상 운동          등산 1회 취미: 수채화 1달 1그림  재정: 식비 10만원 이하 도전(외식-한달기준) 공부: CPA 과목들 각 과목 누적 5회독 이상            기술신용평가사 3급 취득 운동: 플라잉요가          4일주기 2일 이상 40분 이상 운동          등산 1회 취미: 수채화 1달 1그림 재정: 식비 10만원 이하 도전(외식-한달기준) (변경가능) 공부: CPA 과목들 각 과목 누적 7회독 이상 운동: 플라잉요가          4일주기 2일 이상 40분 이상 운동          등산 1회 취미: 수채화 1달 1그림 재정: 식비 10만원 이하 도전(외식-한달기준) (변경가능) 운동: 플라잉요가          4일주기 2일 이상 40분 이상 운동          등산 1회 취미: 수채화 1달 1그림 재정: 식비 10만원 이하 도전(외식-한달기준) 아직까지 투명하게 뭔가 그려지지 않는데 일단 뭐 자격증 하나하나 하다보면 답이 나오지 않을까..  원래 호흡이 긴 공부는 힘든 법.. 할 수 있는데까지 그냥 해보는 수밖에😌 그거 외엔 딱히 낙이란게 없어서 이제 노는것도 질릴대로 질렸고 그냥 뭔가 흠. 내가 할 수 있는 것들을 열심히 하는 그런 후회없는 2022가 되었음 한다.🤔 성공하면 진짜 너무 좋고😆😆😆 만일 실패한대도, 이 정도했음 다음번엔 꼭 될거다라는 굳건한 믿음이 생길만큼 뭔가 많이 탄탄하게 쌓아올린 한 해가 됐음을 기원한다. 오늘의 스터디 약 1시간 30분… 요즘 주변사람들을 정말 잘 못챙기는데 물론 이게 좋지 않단 것도 알지만, 현재 나한테 놓인 것들이 나에겐 아직 너무 애틋하고 시급한 것들이라🥲 2022년에도 어쩔 수 없이 유예하는 부분이 생길 것 같다. 하지만, 지금 꽃이 아니라고 슬퍼할 이유가 없는 것처럼 꽃봉오리가 피어날 거라는 믿음만 있다면 일단 그 꽃봉오리를 빨리 피우기 위해 현재 노력해야겠다. 2022 HAPPY HAPPY NEW YEAR!☺️☺️ ",http://blog.naver.com/PostView.naver?blogId=govl117ghgh&logNo=222610408679&from=search&redirect=Log&widgetTypeCall=true&directAccess=false
